{
  "schemaVersion": 1,
  "registryVersion": "1.10.0",
  "definitions": [
    {
      "key": "models.agent.mode",
      "owner": "models.agent-runtime",
      "category": "models",
      "name": "Agent model mode",
      "description": "Choose legacy environment inheritance, a local OpenAI-compatible model, or a cloud model connection.",
      "valueType": "enum",
      "defaultValue": "inherit",
      "allowedScopes": ["user-device", "vault", "session"],
      "sensitivity": "public",
      "validator": { "id": "enum", "enum": ["inherit", "local", "cloud"] },
      "requires": [],
      "applyMode": "next-operation",
      "visibility": "normal"
    },
    {
      "key": "models.agent.provider",
      "owner": "models.agent-runtime",
      "category": "models",
      "name": "Agent model provider",
      "description": "Provider identity passed to the Agent/Compiler OpenAI-compatible runtime.",
      "valueType": "enum",
      "defaultValue": "ollama",
      "allowedScopes": ["user-device", "vault", "session"],
      "sensitivity": "public",
      "validator": { "id": "enum", "enum": ["ollama", "openai-compatible", "anthropic", "qwen", "doubao", "minimax"] },
      "requires": ["models.agent.mode"],
      "applyMode": "next-operation",
      "visibility": "normal"
    },
    {
      "key": "models.agent.base_url",
      "owner": "models.agent-runtime",
      "category": "models",
      "name": "Agent model base URL",
      "description": "OpenAI-compatible API base URL used by the Agent/Compiler runtime.",
      "valueType": "string",
      "defaultValue": "http://127.0.0.1:11434/v1",
      "allowedScopes": ["user-device", "vault", "session"],
      "sensitivity": "public",
      "validator": { "id": "url", "required": true, "pattern": "^https?://[^\\s]+$" },
      "requires": ["models.agent.mode"],
      "applyMode": "next-operation",
      "visibility": "advanced",
      "placeholder": "http://127.0.0.1:11434/v1"
    },
    {
      "key": "models.agent.model",
      "owner": "models.agent-runtime",
      "category": "models",
      "name": "Agent model identifier",
      "description": "Model identifier sent to the configured Agent/Compiler endpoint.",
      "valueType": "string",
      "defaultValue": "qwen3:8b",
      "allowedScopes": ["user-device", "vault", "session"],
      "sensitivity": "public",
      "validator": { "id": "non-empty-string", "required": true, "minLength": 1, "maxLength": 200 },
      "requires": ["models.agent.mode"],
      "applyMode": "next-operation",
      "visibility": "normal",
      "placeholder": "qwen3:8b"
    },
    {
      "key": "models.agent.secret_ref",
      "owner": "models.agent-runtime",
      "category": "models",
      "name": "Agent cloud credential reference",
      "description": "Opaque reference to the cloud model credential; local mode never resolves or forwards it.",
      "valueType": "secret-reference",
      "defaultSecretRef": {
        "provider": "environment",
        "locator": "OPENAI_API_KEY"
      },
      "allowedScopes": ["user-device", "session"],
      "sensitivity": "secret-reference",
      "validator": { "id": "secret-reference" },
      "requires": ["models.agent.mode"],
      "applyMode": "next-operation",
      "visibility": "advanced",
      "placeholder": "environment:OPENAI_API_KEY"
    },
    {
      "key": "adapters.enabled",
      "owner": "runtime.adapter-registry",
      "category": "adapters",
      "name": "Enabled runtime adapters",
      "description": "Select the adapters initialized by the MCP host. Legacy VAULT_MIND_ADAPTERS is consulted only while this key remains at product scope.",
      "valueType": "list",
      "defaultValue": ["filesystem", "memu", "gitnexus", "obsidian", "kanban", "qmd", "lightrag", "raganything", "hindsight", "vaultbrain", "graphify"],
      "allowedScopes": ["user-device", "vault", "workspace-project", "session"],
      "sensitivity": "public",
      "validator": { "id": "adapter-list" },
      "requires": [],
      "applyMode": "restart-required",
      "visibility": "normal"
    },
    {
      "key": "adapters.memu.dsn",
      "owner": "runtime.adapter-memu",
      "category": "adapters",
      "name": "MemU PostgreSQL endpoint",
      "description": "Credential-free PostgreSQL DSN for MemU. A credential-bearing DSN must be stored behind the separate Secret Reference.",
      "valueType": "string",
      "defaultValue": "postgresql://localhost:5432/memu",
      "allowedScopes": ["user-device", "session"],
      "sensitivity": "local",
      "validator": { "id": "url", "required": true, "pattern": "^postgres(?:ql)?://[^\\s?#]+$" },
      "requires": ["adapters.enabled"],
      "applyMode": "restart-required",
      "visibility": "advanced",
      "placeholder": "postgresql://localhost:5432/memu"
    },
    {
      "key": "adapters.memu.secret_ref",
      "owner": "runtime.adapter-memu",
      "category": "adapters",
      "name": "MemU database credential reference",
      "description": "Optional device-local reference to the complete credential-bearing DSN, resolved only immediately before MemU construction.",
      "valueType": "secret-reference",
      "defaultSecretRef": { "provider": "environment", "locator": "MEMU_DSN" },
      "allowedScopes": ["user-device", "session"],
      "sensitivity": "secret-reference",
      "validator": { "id": "secret-reference" },
      "requires": ["adapters.memu.dsn"],
      "applyMode": "restart-required",
      "visibility": "advanced",
      "placeholder": "environment:MEMU_DSN"
    },
    {
      "key": "adapters.memu.user_id",
      "owner": "runtime.adapter-memu",
      "category": "adapters",
      "name": "MemU user scope",
      "description": "MemU user_id filter used for recall queries.",
      "valueType": "string",
      "defaultValue": "default",
      "allowedScopes": ["user-device", "vault", "workspace-project", "session"],
      "sensitivity": "public",
      "validator": { "id": "non-empty-string", "required": true, "maxLength": 300 },
      "requires": ["adapters.memu.dsn"],
      "applyMode": "restart-required",
      "visibility": "advanced"
    },
    {
      "key": "adapters.memu.max_results",
      "owner": "runtime.adapter-memu",
      "category": "adapters",
      "name": "MemU default result limit",
      "description": "Default maximum MemU results before per-query overrides.",
      "valueType": "integer",
      "defaultValue": 20,
      "allowedScopes": ["vault", "workspace-project", "session"],
      "sensitivity": "public",
      "validator": { "id": "integer", "min": 1, "max": 100 },
      "requires": ["adapters.memu.dsn"],
      "applyMode": "restart-required",
      "visibility": "advanced"
    },
    {
      "key": "adapters.memu.query_timeout_ms",
      "owner": "runtime.adapter-memu",
      "category": "adapters",
      "name": "MemU query timeout",
      "description": "PostgreSQL query timeout for MemU recall.",
      "valueType": "integer",
      "defaultValue": 5000,
      "allowedScopes": ["user-device", "vault", "workspace-project", "session"],
      "sensitivity": "public",
      "validator": { "id": "integer", "min": 100, "max": 300000 },
      "requires": ["adapters.memu.dsn"],
      "applyMode": "restart-required",
      "visibility": "advanced"
    },
    {
      "key": "adapters.memu.exclude_memory_types",
      "owner": "runtime.adapter-memu",
      "category": "adapters",
      "name": "MemU excluded memory types",
      "description": "Memory types excluded from the high-dimensional fallback query.",
      "valueType": "list",
      "defaultValue": ["event"],
      "allowedScopes": ["vault", "workspace-project", "session"],
      "sensitivity": "public",
      "validator": { "id": "string-list" },
      "requires": ["adapters.memu.dsn"],
      "applyMode": "restart-required",
      "visibility": "advanced"
    },
    {
      "key": "adapters.memu.graph_python",
      "owner": "runtime.adapter-memu",
      "category": "adapters",
      "name": "MemU graph Python",
      "description": "Device-local Python executable for memu_graph recall.",
      "valueType": "path",
      "defaultValue": "python",
      "allowedScopes": ["user-device", "session"],
      "sensitivity": "local",
      "validator": { "id": "non-empty-path", "required": true, "maxLength": 1000 },
      "requires": ["adapters.memu.dsn"],
      "applyMode": "restart-required",
      "visibility": "advanced"
    },
    {
      "key": "adapters.memu.graph_cwd",
      "owner": "runtime.adapter-memu",
      "category": "adapters",
      "name": "MemU graph working directory",
      "description": "Device-local working directory from which memu_graph can be imported.",
      "valueType": "path",
      "defaultValue": ".",
      "allowedScopes": ["user-device", "session"],
      "sensitivity": "local",
      "validator": { "id": "non-empty-path", "required": true, "maxLength": 2000 },
      "requires": ["adapters.memu.dsn"],
      "applyMode": "restart-required",
      "visibility": "advanced"
    },
    {
      "key": "adapters.memu.graph_timeout_ms",
      "owner": "runtime.adapter-memu",
      "category": "adapters",
      "name": "MemU graph timeout",
      "description": "Timeout for the memu_graph subprocess recall path.",
      "valueType": "integer",
      "defaultValue": 15000,
      "allowedScopes": ["user-device", "vault", "session"],
      "sensitivity": "public",
      "validator": { "id": "integer", "min": 100, "max": 300000 },
      "requires": ["adapters.memu.dsn"],
      "applyMode": "restart-required",
      "visibility": "advanced"
    },
    {
      "key": "adapters.memu.search_script",
      "owner": "runtime.adapter-memu",
      "category": "adapters",
      "name": "MemU fallback search script",
      "description": "Device-local memu_search.py path used when graph recall is unavailable.",
      "valueType": "path",
      "defaultValue": "memu_search.py",
      "allowedScopes": ["user-device", "session"],